{
  "schema_version": "1.0.0",
  "id": "3df5479d-9eb2-583f-8531-66ba0bb61204",
  "workspace_id": "b5ec9caa-2b49-5c91-9dc0-798645c11a37",
  "ownership_type": "system",
  "name": "标准视频生产",
  "slug": "standard-production",
  "description": "以脚本为检索意图，配音与本地素材召回并行，再冻结旁白时序、素材选择和 EDL 后渲染质检。",
  "visibility": "public_readonly",
  "status": "active",
  "version": 2,
  "nodes": [
    {
      "key": "research",
      "operation": "research.collect",
      "depends_on": [],
      "required": true,
      "maximum_attempts": 3,
      "timeout_seconds": 900,
      "review_gate": false
    },
    {
      "key": "write",
      "operation": "writing.compose",
      "depends_on": ["research"],
      "required": true,
      "maximum_attempts": 3,
      "timeout_seconds": 900,
      "review_gate": false
    },
    {
      "key": "tts",
      "operation": "audio.synthesize",
      "depends_on": ["write"],
      "required": true,
      "maximum_attempts": 3,
      "timeout_seconds": 900,
      "review_gate": false
    },
    {
      "key": "retrieve",
      "operation": "media.retrieve",
      "depends_on": ["write"],
      "required": true,
      "maximum_attempts": 6,
      "timeout_seconds": 900,
      "review_gate": false
    },
    {
      "key": "timeline",
      "operation": "timeline.align",
      "depends_on": ["write", "tts", "retrieve"],
      "required": true,
      "maximum_attempts": 3,
      "timeout_seconds": 900,
      "review_gate": false
    },
    {
      "key": "render",
      "operation": "render.edl",
      "depends_on": ["tts", "retrieve", "timeline"],
      "required": true,
      "maximum_attempts": 2,
      "timeout_seconds": 3600,
      "review_gate": false
    },
    {
      "key": "quality",
      "operation": "quality.evaluate",
      "depends_on": ["render"],
      "required": true,
      "maximum_attempts": 2,
      "timeout_seconds": 900,
      "review_gate": false
    }
  ],
  "capability_requirements": [
    "model.text_generation",
    "research.web_acquisition",
    "media.retrieve",
    "timeline.align",
    "render.edl",
    "render.subtitle_sentence"
  ],
  "content_hash": "9b0f9976c4ab9d05c06e3e30e9f7f3caf908ccdbe51ac435d4939357e122726c",
  "created_by": "e1574325-feff-5570-a90f-2261616c9872",
  "created_at": "2026-08-22T00:00:00Z",
  "published_at": "2026-08-22T00:00:00Z"
}
