{
  "schema_version": "1.0.0",
  "id": "fe7d52b9-7412-5c96-8214-398f18a2d682",
  "workspace_id": "b5ec9caa-2b49-5c91-9dc0-798645c11a37",
  "ownership_type": "system",
  "name": "全 AI 影片生产（历史版）",
  "slug": "full-ai-production",
  "description": "首版生成管线，仅用于保存既有 Run 的不可变执行图；新任务不得使用。",
  "visibility": "public_readonly",
  "status": "archived",
  "version": 1,
  "nodes": [
    {"key": "research", "operation": "research.collect", "depends_on": [], "required": true, "maximum_attempts": 3, "timeout_seconds": 900, "review_gate": false},
    {"key": "write", "operation": "writing.compose", "depends_on": ["research"], "required": true, "maximum_attempts": 3, "timeout_seconds": 900, "review_gate": false},
    {"key": "tts", "operation": "audio.synthesize", "depends_on": ["write"], "required": true, "maximum_attempts": 3, "timeout_seconds": 900, "review_gate": false},
    {"key": "generate", "operation": "media.generate", "depends_on": ["write", "tts"], "required": true, "maximum_attempts": 6, "timeout_seconds": 7200, "review_gate": false},
    {"key": "retrieve", "operation": "media.retrieve", "depends_on": ["write", "generate"], "required": true, "maximum_attempts": 3, "timeout_seconds": 900, "review_gate": false},
    {"key": "timeline", "operation": "timeline.align", "depends_on": ["write", "tts", "retrieve"], "required": true, "maximum_attempts": 3, "timeout_seconds": 900, "review_gate": false},
    {"key": "render", "operation": "render.edl", "depends_on": ["tts", "retrieve", "timeline"], "required": true, "maximum_attempts": 2, "timeout_seconds": 3600, "review_gate": false},
    {"key": "quality", "operation": "quality.evaluate", "depends_on": ["render"], "required": true, "maximum_attempts": 2, "timeout_seconds": 900, "review_gate": false}
  ],
  "capability_requirements": [
    "model.text_generation",
    "model.video_generation",
    "research.web_acquisition",
    "media.generate",
    "media.retrieve",
    "timeline.align",
    "render.edl",
    "render.subtitle_sentence"
  ],
  "content_hash": "bcd052d85ff4ac079a6aca18499686ede2486a2e22514f20fb73c151a55aced9",
  "created_by": "e1574325-feff-5570-a90f-2261616c9872",
  "created_at": "2026-08-23T00:00:00Z",
  "published_at": "2026-08-23T00:00:00Z"
}
